<?xml version="1.0" encoding="ISO-8859-1"?>
<?xml-stylesheet type="text/xsl" href="personas.xsl"?>
<personas xmlns:xsi="http://www.w3.org/2001/XMLSchema-instance" xsi:noNamespaceSchemaLocation="ejercicio1.xsd">
    <persona id="1" clave="adm">
        <datos provincia="PTV">
            <nombre>María</nombre>
            <apellidos>López</apellidos>
        </datos>
        <categoria>102</categoria>
    </persona>
    <persona id="2" clave="user">
        <datos provincia="PTV">
            <nombre>Rodolfo</nombre>
            <apellidos>Justo</apellidos>
        </datos>
        <categoria>104</categoria>
    </persona>
</personas>
